{
  "id": "01jrcasebox0000000000000e1",
  "tenant_id": "tenant-local-v1",
  "actor_user_id": "local-user",
  "matter_id": "01jrcasebox0000000000000m1",
  "source_document_id": "01jrcasebox0000000000000d1",
  "exhibit_page_range": "3-5",
  "lawyer_weight": "moderate",
  "status": "proposed",
  "supersedes_evidence_id": null,
  "notes": "Identifies the counterparty's acknowledgment of the contractual obligation.",
  "created_at": "2026-05-20T10:15:00.000Z"
}
